javax.naming.MalformedLinkException,This exception is thrown when a malformed link was encountered while resolving or constructing a link.  Synchronization and serialization issues that apply to LinkException apply directly here.,,,
javax.naming.NameAlreadyBoundException,This exception is thrown by methods to indicate that a binding cannot be added because the name is already bound to another object.  Synchronization and serialization issues that apply to NamingException apply directly here.,,,
javax.naming.NameNotFoundException,This exception is thrown when a component of the name cannot be resolved because it is not bound.  Synchronization and serialization issues that apply to NamingException apply directly here.,,,
javax.naming.NamingException,"This is the superclass of all exceptions thrown by operations in the Context and DirContext interfaces. The nature of the failure is described by the name of the subclass. This exception captures the information pinpointing where the operation failed, such as where resolution last proceeded to.   Resolved Name. Portion of name that has been resolved.  Resolved Object. Object to which resolution of name proceeded.  Remaining Name. Portion of name that has not been resolved.  Explanation. Detail explaining why name resolution failed.  Root Exception. The exception that caused this naming exception                     to be thrown. null is an acceptable value for any of these fields. When null, it means that no such information has been recorded for that field. A NamingException instance is not synchronized against concurrent multithreaded access. Multiple threads trying to access and modify a single NamingException instance should lock the object. This exception has been retrofitted to conform to the general purpose exception-chaining mechanism.  The root exception (or root cause) is the same object as the cause returned by the Throwable.getCause() method.",,,
javax.naming.NamingSecurityException,"This is the superclass of security-related exceptions thrown by operations in the Context and DirContext interfaces. The nature of the failure is described by the name of the subclass. If the program wants to handle this exception in particular, it should catch NamingSecurityException explicitly before attempting to catch NamingException. A program might want to do this, for example, if it wants to treat security-related exceptions specially from other sorts of naming exception.  Synchronization and serialization issues that apply to NamingException apply directly here.",,,
javax.naming.NoInitialContextException,"This exception is thrown when no initial context implementation can be created.  The policy of how an initial context implementation is selected is described in the documentation of the InitialContext class. This exception can be thrown during any interaction with the InitialContext, not only when the InitialContext is constructed. For example, the implementation of the initial context might lazily retrieve the context only when actual methods are invoked on it. The application should not have any dependency on when the existence of an initial context is determined.  Synchronization and serialization issues that apply to NamingException apply directly here.",,,
javax.naming.NoPermissionException,This exception is thrown when attempting to perform an operation for which the client has no permission. The access control/permission model is dictated by the directory/naming server.  Synchronization and serialization issues that apply to NamingException apply directly here.,,,
javax.naming.NotContextException,"This exception is thrown when a naming operation proceeds to a point where a context is required to continue the operation, but the resolved object is not a context. For example, Context.destroy() requires that the named object be a context. If it is not, NotContextException is thrown. Another example is a non-context being encountered during the resolution phase of the Context methods. It is also thrown when a particular subtype of context is required, such as a DirContext, and the resolved object is a context but not of the required subtype.  Synchronization and serialization issues that apply to NamingException apply directly here.",,,
javax.naming.OperationNotSupportedException,"This exception is thrown when a context implementation does not support the operation being invoked. For example, if a server does not support the Context.bind() method it would throw OperationNotSupportedException when the bind() method is invoked on it.  Synchronization and serialization issues that apply to NamingException apply directly here.",,,
javax.naming.PartialResultException,"This exception is thrown to indicate that the result being returned or returned so far is partial, and that the operation cannot be completed.  For example, when listing a context, this exception indicates that returned results only represents some of the bindings in the context.  Synchronization and serialization issues that apply to NamingException apply directly here.",,,
javax.naming.ReferralException,"This abstract class is used to represent a referral exception, which is generated in response to a referral such as that returned by LDAP v3 servers.  A service provider provides a subclass of ReferralException by providing implementations for getReferralInfo() and getReferralContext() (and appropriate constructors and/or corresponding set"" methods).  The following code sample shows how ReferralException can be used. while (true) {          try {              bindings = ctx.listBindings(name);              while (bindings.hasMore()) {                  b = bindings.next();                  ...              }              break;          } catch (ReferralException e) {              ctx = e.getReferralContext();          }      }  ReferralException is an abstract class. Concrete implementations determine its synchronization and serialization properties. An environment parameter passed to the getReferralContext() method is owned by the caller. The service provider will not modify the object or keep a reference to it"," but may keep a reference to a clone of it.""",,
javax.naming.ServiceUnavailableException,"This exception is thrown when attempting to communicate with a directory or naming service and that service is not available. It might be unavailable for different reasons. For example, the server might be too busy to service the request, or the server might not be registered to service any requests, etc.  Synchronization and serialization issues that apply to NamingException apply directly here.",,,
javax.naming.SizeLimitExceededException,"This exception is thrown when a method produces a result that exceeds a size-related limit. This can happen, for example, if the result contains more objects than the user requested, or when the size of the result exceeds some implementation-specific limit.  Synchronization and serialization issues that apply to NamingException apply directly here.",,,
javax.naming.TimeLimitExceededException,"This exception is thrown when a method does not terminate within the specified time limit. This can happen, for example, if the user specifies that the method should take no longer than 10 seconds, and the method fails to complete with 10 seconds.  Synchronization and serialization issues that apply to NamingException apply directly here.",,,
javax.net.ssl.SSLException,Indicates some kind of error detected by an SSL subsystem. This class is the general class of exceptions produced by failed SSL-related operations.,,,
javax.net.ssl.SSLHandshakeException,Indicates that the client and server could not negotiate the desired level of security.  The connection is no longer usable.,,,
javax.net.ssl.SSLKeyException,"Reports a bad SSL key.  Normally, this indicates misconfiguration of the server or client SSL certificate and private key.",,,
javax.net.ssl.SSLPeerUnverifiedException,"Indicates that the peer's identity has not been verified.  When the peer was not able to identify itself (for example; no certificate, the particular cipher suite being used does not support authentication, or no peer authentication was established during SSL handshaking) this exception is thrown.",,,
javax.net.ssl.SSLProtocolException,Reports an error in the operation of the SSL protocol.  Normally this indicates a flaw in one of the protocol implementations.,,,
javax.print.attribute.UnmodifiableSetException,Thrown to indicate that the requested operation cannot be performed because the set is unmodifiable.,,,
javax.print.AttributeException,"Interface AttributeException is a mixin interface which a subclass of PrintException can implement to report an error condition involving one or more printing attributes that a particular Print Service instance does not support. Either the attribute is not supported at all, or the attribute is supported but the particular specified value is not supported. The Print Service API does not define any print exception classes that implement interface AttributeException, that being left to the Print Service implementor's discretion.",,,
javax.print.FlavorException,"Interface FlavorException is a mixin interface which a subclass of PrintException can implement to report an error condition involving a doc flavor or flavors (class DocFlavor). The Print Service API does not define any print exception classes that implement interface FlavorException, that being left to the Print Service implementor's discretion.",,,
javax.print.PrintException,Class PrintException encapsulates a printing-related error condition that occurred while using a Print Service instance. This base class furnishes only a string description of the error. Subclasses furnish more detailed information if applicable.,,,
javax.print.URIException,"Interface URIException is a mixin interface which a subclass of PrintException can implement to report an error condition involving a URI address. The Print Service API does not define any print exception classes that implement interface URIException, that being left to the Print Service implementor's discretion.",,,
javax.script.ScriptException,The generic Exception class for the Scripting APIs.  Checked exception types thrown by underlying scripting implementations must be wrapped in instances of ScriptException.  The class has members to store line and column numbers and filenames if this information is available.,,,
javax.security.auth.callback.UnsupportedCallbackException,Signals that a CallbackHandler does not recognize a particular Callback.,,,
javax.security.auth.DestroyFailedException,Signals that a destroy operation failed.  This exception is thrown by credentials implementing the Destroyable interface when the destroy method fails.,,,
javax.security.auth.login.AccountException,A generic account exception.,,,
javax.security.auth.login.AccountExpiredException,"Signals that a user account has expired.  This exception is thrown by LoginModules when they determine that an account has expired.  For example, a LoginModule, after successfully authenticating a user, may determine that the user's account has expired.  In this case the LoginModule throws this exception to notify the application.  The application can then take the appropriate steps to notify the user.",,,
javax.security.auth.login.AccountLockedException,Signals that an account was locked.  This exception may be thrown by a LoginModule if it determines that authentication is being attempted on a locked account.,,,
javax.security.auth.login.AccountNotFoundException,Signals that an account was not found.  This exception may be thrown by a LoginModule if it is unable to locate an account necessary to perform authentication.,,,
javax.security.auth.login.CredentialException,A generic credential exception.,,,
javax.security.auth.login.CredentialExpiredException,"Signals that a Credential has expired.  This exception is thrown by LoginModules when they determine that a Credential has expired. For example, a LoginModule authenticating a user in its login method may determine that the user's password, although entered correctly, has expired.  In this case the LoginModule throws this exception to notify the application.  The application can then take the appropriate steps to assist the user in updating the password.",,,
javax.security.auth.login.CredentialNotFoundException,Signals that a credential was not found.  This exception may be thrown by a LoginModule if it is unable to locate a credential necessary to perform authentication.,,,
javax.security.auth.login.FailedLoginException,"Signals that user authentication failed.  This exception is thrown by LoginModules if authentication failed. For example, a LoginModule throws this exception if the user entered an incorrect password.",,,
javax.security.auth.login.LoginException,This is the basic login exception.,,,
javax.security.auth.RefreshFailedException,Signals that a refresh operation failed.  This exception is thrown by credentials implementing the Refreshable interface when the refresh method fails.,,,
javax.security.cert.CertificateEncodingException,Certificate Encoding Exception. This is thrown whenever an error occurs whilst attempting to encode a certificate. Note: The classes in the package javax.security.cert exist for compatibility with earlier versions of the Java Secure Sockets Extension (JSSE). New applications should instead use the standard Java SE certificate classes located in java.security.cert.,,,
javax.security.cert.CertificateException,This exception indicates one of a variety of certificate problems. Note: The classes in the package javax.security.cert exist for compatibility with earlier versions of the Java Secure Sockets Extension (JSSE). New applications should instead use the standard Java SE certificate classes located in java.security.cert.,,,
javax.security.cert.CertificateExpiredException,Certificate Expired Exception. This is thrown whenever the current Date or the specified Date is after the notAfter date/time specified in the validity period of the certificate. Note: The classes in the package javax.security.cert exist for compatibility with earlier versions of the Java Secure Sockets Extension (JSSE). New applications should instead use the standard Java SE certificate classes located in java.security.cert.,,,
javax.security.cert.CertificateNotYetValidException,Certificate is not yet valid exception. This is thrown whenever the current Date or the specified Date is before the notBefore date/time in the Certificate validity period. Note: The classes in the package javax.security.cert exist for compatibility with earlier versions of the Java Secure Sockets Extension (JSSE). New applications should instead use the standard Java SE certificate classes located in java.security.cert.,,,
javax.security.cert.CertificateParsingException,Certificate Parsing Exception. This is thrown whenever invalid DER encoded certificate is parsed or unsupported DER features are found in the Certificate. Note: The classes in the package javax.security.cert exist for compatibility with earlier versions of the Java Secure Sockets Extension (JSSE). New applications should instead use the standard Java SE certificate classes located in java.security.cert.,,,
javax.security.sasl.AuthenticationException,"This exception is thrown by a SASL mechanism implementation to indicate that the SASL exchange has failed due to reasons related to authentication, such as an invalid identity, passphrase, or key.  Note that the lack of an AuthenticationException does not mean that the failure was not due to an authentication error.  A SASL mechanism implementation might throw the more general SaslException instead of AuthenticationException if it is unable to determine the nature of the failure, or if does not want to disclose the nature of the failure, for example, due to security reasons.",,,
javax.security.sasl.SaslException,This class represents an error that has occurred when using SASL.,,,
javax.sound.midi.InvalidMidiDataException,"An InvalidMidiDataException indicates that inappropriate MIDI data was encountered. This often means that the data is invalid in and of itself, from the perspective of the MIDI specification.  An example would be an undefined status byte.  However, the exception might simply mean that the data was invalid in the context it was used, or that the object to which the data was given was unable to parse or use it. For example, a file reader might not be able to parse a Type 2 MIDI file, even though that format is defined in the MIDI specification.",,,
javax.sound.midi.MidiUnavailableException,"A MidiUnavailableException is thrown when a requested MIDI component cannot be opened or created because it is unavailable.  This often occurs when a device is in use by another application.  More generally, it can occur when there is a finite number of a certain kind of resource that can be used for some purpose, and all of them are already in use (perhaps all by this application).  For an example of the latter case, see the setReceiver method of Transmitter.",,,
javax.sound.sampled.LineUnavailableException,A LineUnavailableException is an exception indicating that a line cannot be opened because it is unavailable.  This situation arises most commonly when a requested line is already in use by another application.,,,
javax.sound.sampled.UnsupportedAudioFileException,An UnsupportedAudioFileException is an exception indicating that an operation failed because a file did not contain valid data of a recognized file type and format.,,,
javax.sql.rowset.serial.SerialException,"Indicates and an error with the serialization or de-serialization of SQL types such as BLOB, CLOB, STRUCT or ARRAY in addition to SQL types such as DATALINK and JAVAOBJECT",,,
javax.sql.rowset.spi.SyncFactoryException,Indicates an error with SyncFactory mechanism. A disconnected RowSet implementation cannot be used  without a SyncProvider being successfully instantiated,,,
javax.sql.rowset.spi.SyncProviderException,"Indicates an error with the SyncProvider mechanism. This exception is created by a SyncProvider abstract class extension if it encounters violations in reading from or writing to the originating data source.  If it is implemented to do so, the SyncProvider object may also create a SyncResolver object and either initialize the SyncProviderException object with it at construction time or set it with the SyncProvider object at a later time.  The method acceptChanges will throw this exception after the writer has finished checking for conflicts and has found one or more conflicts. An application may catch a SyncProviderException object and call its getSyncResolver method to get its SyncResolver object. See the code fragment in the interface comment for SyncResolver for an example. This SyncResolver object will mirror the RowSet object that generated the exception, except that it will contain only the values from the data source that are in conflict.  All other values in the SyncResolver object will be null.  The SyncResolver object may be used to examine and resolve each conflict in a row and then go to the next row with a conflict to repeat the procedure.  A SyncProviderException object may or may not contain a description of the condition causing the exception.  The inherited method getMessage may be called to retrieve the description if there is one.",,,
javax.swing.text.BadLocationException,"This exception is to report bad locations within a document model (that is, attempts to reference a location that doesn't exist).  Warning: Serialized objects of this class will not be compatible with future Swing releases. The current serialization support is appropriate for short term storage or RMI between applications running the same version of Swing.  As of 1.4, support for long term storage of all JavaBeans&trade; has been added to the java.beans package. Please see XMLEncoder.",,,
javax.swing.text.ChangedCharSetException,ChangedCharSetException as the name indicates is an exception thrown when the charset is changed.,,,
javax.swing.tree.ExpandVetoException,Exception used to stop and expand/collapse from happening. See How to Write a Tree-Will-Expand Listener in The Java Tutorial for further information and examples.,,,
javax.swing.undo.CannotRedoException,"Thrown when an UndoableEdit is told to redo() and can't.  Warning: Serialized objects of this class will not be compatible with future Swing releases. The current serialization support is appropriate for short term storage or RMI between applications running the same version of Swing.  As of 1.4, support for long term storage of all JavaBeans&trade; has been added to the java.beans package. Please see XMLEncoder.",,,
javax.swing.undo.CannotUndoException,"Thrown when an UndoableEdit is told to undo() and can't.  Warning: Serialized objects of this class will not be compatible with future Swing releases. The current serialization support is appropriate for short term storage or RMI between applications running the same version of Swing.  As of 1.4, support for long term storage of all JavaBeans&trade; has been added to the java.beans package. Please see XMLEncoder.",,,
javax.swing.UnsupportedLookAndFeelException,"An exception that indicates the requested look &amp; feel management classes are not present on the user's system.  Warning: Serialized objects of this class will not be compatible with future Swing releases. The current serialization support is appropriate for short term storage or RMI between applications running the same version of Swing.  As of 1.4, support for long term storage of all JavaBeans&trade; has been added to the java.beans package. Please see XMLEncoder.",,,
javax.transaction.InvalidTransactionException,"This exception indicates that the request carried an invalid transaction context. For example, this exception could be raised if an error occured when trying to register a resource.",,,
javax.transaction.TransactionRequiredException,"This exception indicates that a request carried a null transaction context, but the target object requires an activate transaction.",,,
javax.transaction.TransactionRolledbackException,"This exception indicates that the transaction associated with processing of the request has been rolled back, or marked to roll back. Thus the requested operation either could not be performed or was not performed because further computation on behalf of the transaction would be fruitless",,,
javax.transaction.xa.XAException,The XAException is thrown by the Resource Manager (RM) to inform the Transaction Manager of an error encountered by the involved transaction.,,,
javax.xml.bind.DataBindingException,"Exception that represents a failure in a JAXB operation.  This exception differs from JAXBException in that this is an unchecked exception, while JAXBException is a checked exception.",,,
javax.xml.bind.JAXBException,This is the root exception class for all JAXB exceptions.,,,
javax.xml.bind.MarshalException,This exception indicates that an error has occurred while performing a marshal operation that the provider is unable to recover from.  The ValidationEventHandler can cause this exception to be thrown during the marshal operations.  See ValidationEventHandler.handleEvent(ValidationEvent).,,,
javax.xml.bind.PropertyException,This exception indicates that an error was encountered while getting or setting a property.,,,
javax.xml.bind.TypeConstraintException,"This exception indicates that a violation of a dynamically checked type constraint was detected.  This exception can be thrown by the generated setter methods of the schema derived Java content classes.  However, since fail-fast validation is an optional feature for JAXB Providers to support, not all setter methods will throw this exception when a type constraint is violated.  If this exception is throw while invoking a fail-fast setter, the value of the property is guaranteed to remain unchanged, as if the setter were never called.",,,
javax.xml.bind.UnmarshalException,This exception indicates that an error has occurred while performing an unmarshal operation that prevents the JAXB Provider from completing the operation.  The ValidationEventHandler can cause this exception to be thrown during the unmarshal operations.  See ValidationEventHandler.handleEvent(ValidationEvent).,,,
javax.xml.bind.ValidationException,This exception indicates that an error has occurred while performing a validate operation.  The ValidationEventHandler can cause this exception to be thrown during the validate operations.  See ValidationEventHandler.handleEvent(ValidationEvent).,,,
javax.xml.crypto.dsig.TransformException,Indicates an exceptional condition that occurred while executing a transform algorithm. A TransformException can contain a cause: another throwable that caused this TransformException to get thrown.,,,
javax.xml.crypto.dsig.XMLSignatureException,Indicates an exceptional condition that occurred during the XML signature generation or validation process. An XMLSignatureException can contain a cause: another throwable that caused this XMLSignatureException to get thrown.,,,
javax.xml.crypto.KeySelectorException,Indicates an exceptional condition thrown by a KeySelector. A KeySelectorException can contain a cause: another throwable that caused this KeySelectorException to get thrown.,,,
javax.xml.crypto.MarshalException,Indicates an exceptional condition that occurred during the XML marshalling or unmarshalling process. A MarshalException can contain a cause: another throwable that caused this MarshalException to get thrown.,,,
javax.xml.crypto.NoSuchMechanismException,This exception is thrown when a particular XML mechanism is requested but is not available in the environment. A NoSuchMechanismException can contain a cause: another throwable that caused this NoSuchMechanismException to get thrown.,,,
